{
  "schema": "stcli.compat-profile/v1",
  "id": "sillytavern-1.18-core",
  "upstream": {
    "repository": "https://github.com/SillyTavern/SillyTavern",
    "tag": "1.18.0",
    "commit": "51ad27fb86d39a3daca3adaa970375c9670c12df",
    "version": "1.18.0"
  },
  "scope": {
    "formats": [
      "character-card-v1-json",
      "character-card-v2-json",
      "character-book-v2-json",
      "lorebook-json",
      "chat-completion-preset-json"
    ],
    "prompt_path": "chat-completion-prompt-manager",
    "generation_types": [
      "normal",
      "continue",
      "regenerate",
      "swipe"
    ],
    "hard_unsupported": [
      "duplicate-json-keys",
      "group-chat",
      "quiet-generation",
      "text-completion",
      "stscript",
      "ui-extension",
      "server-plugin",
      "vector-lore"
    ],
    "documented_fallback": [
      "approximate-tokenizer"
    ],
    "preserved_metadata": [
      "namespaced-extension-data",
      "unknown-json-member"
    ]
  },
  "macros": {
    "exact": [
      "//",
      "addglobalvar",
      "addvar",
      "allChatRange",
      "char",
      "charCreatorNotes",
      "charDepthPrompt",
      "charDescription",
      "charFirstMessage",
      "charInstruction",
      "charPersonality",
      "charPrompt",
      "charScenario",
      "charVersion",
      "currentSwipeId",
      "date",
      "datetimeformat",
      "decglobalvar",
      "decvar",
      "deleteglobalvar",
      "deletevar",
      "description",
      "else",
      "firstDisplayedMessageId",
      "firstIncludedMessageId",
      "getglobalvar",
      "getvar",
      "group",
      "groupNotMuted",
      "hasExtension",
      "hasglobalvar",
      "hasvar",
      "idleDuration",
      "if",
      "incglobalvar",
      "incvar",
      "isodate",
      "isotime",
      "lastCharMessage",
      "lastChatMessage",
      "lastGenerationType",
      "lastMessage",
      "lastMessageId",
      "lastSwipeId",
      "lastUserMessage",
      "long_term_memory",
      "maxContext",
      "maxPrompt",
      "maxResponse",
      "mesExamples",
      "mesExamplesRaw",
      "model",
      "newline",
      "noop",
      "original",
      "outlet",
      "persona",
      "personality",
      "pick",
      "random",
      "reverse",
      "roll",
      "scenario",
      "setglobalvar",
      "setvar",
      "short_term_memory",
      "space",
      "summary",
      "time",
      "timeDiff",
      "trim",
      "user",
      "weekday"
    ],
    "documented_fallback": {
      "unknown": "preserve-literal"
    },
    "hard_unsupported": [
      "input",
      "banned",
      "notChar",
      "isMobile",
      "systemPrompt"
    ],
    "source_files": [
      "public/scripts/macros/definitions/core-macros.js",
      "public/scripts/macros/definitions/env-macros.js",
      "public/scripts/macros/definitions/chat-macros.js",
      "public/scripts/macros/definitions/time-macros.js",
      "public/scripts/macros/definitions/state-macros.js",
      "public/scripts/macros/definitions/variable-macros.js",
      "public/scripts/macros/definitions/instruct-macros.js"
    ]
  },
  "preset_fields": {
    "assistant_prefill": "assembly-behavior",
    "assistant_impersonation": "hard-unsupported",
    "bypass_status_check": "preserved-metadata",
    "bias_preset_selected": "preserved-metadata",
    "chat_completion_source": "preserved-metadata",
    "continue_nudge_prompt": "assembly-behavior",
    "continue_postfix": "documented-fallback",
    "continue_prefill": "assembly-behavior",
    "custom_prompt_post_processing": "documented-fallback",
    "enable_web_search": "hard-unsupported",
    "extensions": "preserved-metadata",
    "frequency_penalty": "provider-behavior",
    "function_calling": "hard-unsupported",
    "group_nudge_prompt": "hard-unsupported",
    "impersonation_prompt": "hard-unsupported",
    "image_inlining": "hard-unsupported",
    "inline_image_quality": "preserved-metadata",
    "max_context_unlocked": "assembly-behavior",
    "media_inlining": "hard-unsupported",
    "min_p": "provider-behavior",
    "n": "provider-behavior",
    "names_behavior": "assembly-behavior",
    "nemo_merge_note": "preserved-metadata",
    "new_chat_prompt": "documented-fallback",
    "new_example_chat_prompt": "documented-fallback",
    "new_group_chat_prompt": "hard-unsupported",
    "openai_max_context": "assembly-behavior",
    "openai_max_tokens": "provider-behavior",
    "presence_penalty": "provider-behavior",
    "personality_format": "documented-fallback",
    "preset_name": "preserved-metadata",
    "prompt_order": "assembly-behavior",
    "prompts": "assembly-behavior",
    "reasoning_effort": "provider-behavior",
    "request_image_aspect_ratio": "hard-unsupported",
    "request_image_resolution": "hard-unsupported",
    "request_images": "hard-unsupported",
    "scenario_format": "documented-fallback",
    "repetition_penalty": "provider-behavior",
    "seed": "provider-behavior",
    "show_thoughts": "preserved-metadata",
    "send_if_empty": "documented-fallback",
    "squash_system_messages": "assembly-behavior",
    "stream_openai": "preserved-metadata",
    "temperature": "provider-behavior",
    "tool_call_recurse_limit": "hard-unsupported",
    "tool_reasoning_mode": "hard-unsupported",
    "top_a": "preserved-metadata",
    "top_k": "provider-behavior",
    "top_p": "provider-behavior",
    "verbosity": "preserved-metadata",
    "wi_format": "documented-fallback",
    "use_sysprompt": "assembly-behavior"
  }
}
